{
  "schema_version": "0.1.0",
  "source_record_id": "gaia-src-facility-risk-cve-exposure",
  "source_name": "Synthetic CVE Exposure Feed",
  "source_family": "cyber",
  "route_family": "fixture/orion-osiris/facility-risk",
  "source_url": "fixture://orion-osiris/facility-risk/cve-exposure",
  "observed_at": "2026-05-29T12:02:00Z",
  "ingested_at": "2026-05-29T12:03:00Z",
  "license_status": "approved_for_fixture",
  "attribution_required": false,
  "commercial_use_status": "allowed",
  "evidence_grade": "fixture.synthetic",
  "risk_class": "low",
  "provenance": {
    "retrieval_mode": "fixture",
    "hash_algorithm": "none",
    "canonicalization_status": "not_applicable",
    "retrieval_notes": "Synthetic passive cyber exposure record for Orion OSIRIS migration MVP."
  },
  "confidence_contribution": 0.65,
  "notes": "Represents passive cyber exposure metadata only. Scanner/sweep execution remains SCOPE-D-owned."
}
