{
  "schema_version": "0.1.0",
  "source_record_id": "gaia-src-facility-risk-fire-weather-alert",
  "source_name": "Synthetic Fire Weather Feed",
  "source_family": "synthetic_fixture",
  "route_family": "fixture/orion-osiris/facility-risk",
  "source_url": "fixture://orion-osiris/facility-risk/fire-weather-alert",
  "observed_at": "2026-05-29T12:00:00Z",
  "ingested_at": "2026-05-29T12:01:00Z",
  "license_status": "approved_for_fixture",
  "attribution_required": false,
  "commercial_use_status": "allowed",
  "evidence_grade": "fixture.synthetic",
  "risk_class": "low",
  "provenance": {
    "retrieval_mode": "fixture",
    "hash_algorithm": "none",
    "canonicalization_status": "not_applicable",
    "retrieval_notes": "Synthetic fire-weather alert for Orion OSIRIS migration MVP."
  },
  "confidence_contribution": 0.7,
  "notes": "Represents the natural-hazard leg of the facility-risk scenario."
}
